{
  "template_id": "DQ7-SEED-002-TPL-008",
  "rule_kind": "distribution_assertion",
  "status": "reserved",
  "gx_class": "partial",
  "notes": "Reserved statistical template until a concrete distribution seed source is selected.",
  "payload": {
    "name": "Distribution placeholder",
    "description": "Reserved template for statistical distribution checks.",
    "dimension": "profiling",
    "active": true,
    "workspace": "default",
    "generated": false,
    "dsl": {
      "schema_version": "2.0.0",
      "rule": {
        "kind": "distribution_assertion",
        "scope": {
          "dataset": {
            "data_object_id": "do-customer"
          }
        },
        "measure": {
          "type": "metric",
          "metric": "quantile",
          "subject": {
            "column": "amount"
          }
        },
        "expectation": {
          "type": "threshold",
          "operator": "between",
          "min_value": 0.05,
          "max_value": 0.95,
          "unit": "raw"
        },
        "evidence": {
          "failed_rows": {
            "mode": "sample",
            "limit": 100,
            "include_row_identifier": true,
            "include_primary_key": true
          },
          "emit_compiled_artifact": true,
          "emit_generated_sql": false
        },
        "operations": {
          "severity": "info",
          "preferred_engines": [
            "sql"
          ],
          "fail_if_not_native": true
        }
      }
    }
  }
}