{
  "template_id": "DQ7-SEED-002-TPL-004",
  "rule_kind": "schema_assertion",
  "status": "drafted",
  "gx_class": "partial",
  "notes": "Canonical schema contract template for required-column checks.",
  "payload": {
    "name": "Customer schema contract",
    "description": "Customer records must expose the required contract columns.",
    "dimension": "schema",
    "active": true,
    "workspace": "default",
    "generated": false,
    "dsl": {
      "schema_version": "2.0.0",
      "rule": {
        "kind": "schema_assertion",
        "scope": {
          "dataset": {
            "data_object_id": "do-customer",
            "data_object_version_id": "dov-customer-v5"
          }
        },
        "measure": {
          "type": "schema",
          "schema_assertion": "required_columns_present"
        },
        "expectation": {
          "type": "schema_contract",
          "required_columns": [
            "customer_id",
            "email",
            "status"
          ]
        },
        "evidence": {
          "failed_rows": {
            "mode": "sample",
            "limit": 100,
            "include_row_identifier": true,
            "include_primary_key": true
          },
          "emit_compiled_artifact": true,
          "emit_generated_sql": false
        },
        "operations": {
          "severity": "critical",
          "preferred_engines": [
            "gx",
            "sql"
          ],
          "fail_if_not_native": false
        }
      }
    }
  }
}